{
  "$schema": "https://json-schema.org/draft/2020-12/schema",
  "title": "DevForgeAI Codex hook policy v1",
  "type": "object",
  "additionalProperties": false,
  "required": [
    "schema",
    "mode",
    "protected_paths",
    "deny_outside_project",
    "allowed_external_redirects",
    "denied_commands",
    "receipt_agents",
    "receipt_schema",
    "receipt_statuses",
    "max_receipt_bytes",
    "max_context_chars",
    "check_config"
  ],
  "properties": {
    "schema": {
      "type": "string",
      "const": "devforgeai.hookd-policy/v1"
    },
    "mode": {
      "type": "string",
      "enum": [
        "observe",
        "enforce"
      ]
    },
    "protected_paths": {
      "type": "array",
      "minItems": 1,
      "maxItems": 256,
      "uniqueItems": true,
      "items": {
        "type": "string",
        "minLength": 1,
        "maxLength": 512,
        "anyOf": [
          {
            "pattern": "^(?!/)(?!\\./)(?!.*//)(?!.*(?:^|/)\\.{1,2}(?:/|$))(?!.*[*?\\[\\\\])(?!.*[\\u0000-\\u001F])(?!.*\\/$).+$"
          },
          {
            "pattern": "^(?!/)(?!\\./)(?!.*//)(?!.*(?:^|/)\\.{1,2}(?:/|$))(?!.*[\\u0000-\\u001F])[^*?\\[\\\\]+/\\*\\*$"
          }
        ]
      }
    },
    "deny_outside_project": {
      "type": "boolean"
    },
    "allowed_external_redirects": {
      "type": "array",
      "maxItems": 64,
      "uniqueItems": true,
      "items": {
        "type": "string",
        "minLength": 1,
        "maxLength": 512,
        "pattern": "^/(?!/)(?!.*//)(?!.*(?:^|/)\\.{1,2}(?:/|$))(?!.*[$`~*?\\[\\]{}()\\\\])(?!.*[\\u0000-\\u001F])(?!.*\\/$).+$"
      }
    },
    "denied_commands": {
      "type": "array",
      "maxItems": 256,
      "items": {
        "type": "object",
        "additionalProperties": false,
        "required": [
          "id",
          "pattern"
        ],
        "properties": {
          "id": {
            "type": "string",
            "pattern": "^[A-Z][A-Z0-9_]{1,63}$",
            "maxLength": 64
          },
          "pattern": {
            "type": "string",
            "minLength": 1,
            "maxLength": 1024,
            "pattern": "^\\^"
          }
        }
      }
    },
    "receipt_agents": {
      "type": "array",
      "maxItems": 128,
      "uniqueItems": true,
      "items": {
        "type": "string",
        "minLength": 1,
        "pattern": "^[A-Za-z0-9_.:-]+$",
        "maxLength": 128
      }
    },
    "receipt_schema": {
      "type": "string",
      "const": "devforgeai.worker-result/v1"
    },
    "receipt_statuses": {
      "type": "array",
      "minItems": 1,
      "maxItems": 16,
      "uniqueItems": true,
      "items": {
        "type": "string",
        "enum": [
          "pass",
          "fail",
          "needs_user",
          "could_not_run"
        ]
      }
    },
    "max_receipt_bytes": {
      "type": "integer",
      "minimum": 1024,
      "maximum": 65536
    },
    "max_context_chars": {
      "type": "integer",
      "minimum": 128,
      "maximum": 16384
    },
    "check_config": {
      "type": "object",
      "propertyNames": {
        "pattern": "^[a-z][a-z0-9_]{1,63}$"
      },
      "additionalProperties": {
        "type": "object"
      }
    }
  }
}
